{
  "candidate_sha": "d5ca972b74688eab1c5e3eee63bb89306b55d6a0",
  "created_at": "2026-07-18T10:21:20.350999+00:00",
  "deployment_manifest": {
    "path": "/var/lib/librarian/deployments/20260718T102051Z-d5ca972b7468.json",
    "sha256": "bf17faf2a37fa4ee65017b98325026de8c6838d2a50a52806e3d94a8b0415a93",
    "status": "DEPLOYED"
  },
  "restart_persistence_proof": {
    "path": "/var/lib/librarian/deployments/proofs/release-proof-d5ca972b7468-29640621032-1/restart-persistence-receipt.json",
    "sha256": "0399c0af75678c497565736fbbcebdb7ff63fd0c3f10fe9934d82500d34fe063",
    "status": "PASS"
  },
  "schema_version": "librarian-release-finalization/v1",
  "status": "RELEASE_VERIFIED"
}
